Tez No,Yazar,Yıl,Tez Adı,Üniversite,Dil,Tez Türü,Konu
713534,ELVAN KÜBRA DOĞAN,2021,Veri madenciliği sınıflandırma yöntemlerinin veri bilimi anketi veri seti ile karşılaştırmalı analizi,Düzce Üniversitesi,Türkçe,Yüksek Lisans,Bilgisayar Mühendisliği Bilimleri-Bilgisayar ve Kontrol = Computer Engineering and Computer Science and Control
713853,SAKIN CAN,2021,Lise öğrencilerinin üniversiteye giriş başarılarının eğitsel veri madenciliği ile tahmin edilmesi,Beykent Üniversitesi,Türkçe,Yüksek Lisans,Bilgisayar Mühendisliği Bilimleri-Bilgisayar ve Kontrol = Computer Engineering and Computer Science and Control
661412,GÖKÇEN ŞAHİN,2021,Oksidatif fosforilasyon sistemi hastalıklarında mitokondriyal DNA varyantlarının veri madenciliği ile araştırılması,İstanbul Üniversitesi,Türkçe,Yüksek Lisans,Bilgisayar Mühendisliği Bilimleri-Bilgisayar ve Kontrol = Computer Engineering and Computer Science and Control ; Genetik = Genetics
666630,EMRE CİHAN ATEŞ,2021,Önleyici kolluk faaliyetleri kapsamında sosyal medyada veri madenciliği: Suçları önlemek için Twitter Analytic\'i kullanma,Ankara Üniversitesi,Türkçe,Doktora,Bilgisayar Mühendisliği Bilimleri-Bilgisayar ve Kontrol = Computer Engineering and Computer Science and Control
673458,HANİFE AVCI,2021,Tıbbi görüntü işleme ile tanı koymada veri madenciliği ve derin öğrenme yöntemlerinin performanslarının incelenmesi,Hacettepe Üniversitesi,Türkçe,Yüksek Lisans,Biyoistatistik = Biostatistics
683392,BATUHAN BAKIRARAR,2021,Veri madenciliğinde hibrit model yaklaşımı,Ankara Üniversitesi,Türkçe,Doktora,Biyoistatistik = Biostatistics
660888,EZGİ DEMİR,2021,Üretim planlama ve kontrol süreçlerinde veri madenciliğinin yeri ve çok kriterli karar alma yaklaşımlarıyla çözüm önerileri: Bir işletme uygulaması,Marmara Üniversitesi,Türkçe,Doktora,Ekonometri = Econometrics
681548,AHMET POLAT,2021,Açık öğretim liseleri öğrencilerinin okul terki ve mezuniyet durumlarının eğitsel veri madenciliği ile incelenmesi,Sakarya Üniversitesi,Türkçe,Doktora,Eğitim ve Öğretim = Education and Training
630646,GÖRKEM CEYHAN,2020,Sınıflandırmada kullanılan veri madenciliği yöntemlerinin performanslarının veri seti özelliklerine göre karşılaştırılması,Gazi Üniversitesi,Türkçe,Doktora,Eğitim ve Öğretim = Education and Training
680099,NURİ ÇELİKER,2020,"Konaklama işletmelerinde toksik liderlik ölçeğinin geliştirilmesi ve toksik liderlik, lider-üye etkileşimi, iş stresi, duygusal tükenmişlik değişkenleri bağlamında örgütsel vatandaşlık davranışının veri madenciliği yöntemi ile incelenmesi",Akdeniz Üniversitesi,Türkçe,Doktora,Turizm = Tourism ; İşletme = Business Administration
672695,OKTAY MESUT ARSLAN,2020,Veri madenciliği ile talep tahmini ve bir işletmede uygulama,Gazi Üniversitesi,Türkçe,Yüksek Lisans,Mühendislik Bilimleri = Engineering Sciences
689237,DİDEM TUNCEL,2020,Suriyeli göçmenlerin Türk halkı ile kaynaştırılması çalışmaları üzerine veri madenciliği araştırması,Hacettepe Üniversitesi,Türkçe,Yüksek Lisans,İstatistik = Statistics
672687,MEHMET SEYREK,2020,Kadına yönelik aile içi şiddetin veri madenciliği ile analizi: Türkiye uygulaması,Gazi Üniversitesi,Türkçe,Yüksek Lisans,Mühendislik Bilimleri = Engineering Sciences
653754,SERDAR KILIÇSEL,2020,Veri madenciliği teknikleri ile sigorta satış stratejilerinin belirlenmesi,Bahçeşehir Üniversitesi,Türkçe,Yüksek Lisans,Bilgisayar Mühendisliği Bilimleri-Bilgisayar ve Kontrol = Computer Engineering and Computer Science and Control
635459,OLGUN ÖZDEMİR,2020,Gelir ve yaşam koşulları verisinin veri madenciliği yaklaşımı ile incelenmesi ve model performanslarının değerlendirilmesi,Yıldız Teknik Üniversitesi,Türkçe,Doktora,İstatistik = Statistics
651385,AYŞE MERVE PARLAKTUNA,2020,Baskılı devre kartı montajında hata birlikteliklerini ve örüntülerini keşfederek ürün kalitesini iyileştirmek için veri madenciliği,Hacettepe Üniversitesi,Türkçe,Yüksek Lisans,Endüstri ve Endüstri Mühendisliği = Industrial and Industrial Engineering
609009,ESRA TAŞKIN,2020,Nicel birikimin nitel değişime etkisi: Kütüphane yönetiminde veri madenciliği uygulaması,Trakya Üniversitesi,Türkçe,Yüksek Lisans,Bilgi ve Belge Yönetimi = Information and Records Management ; İşletme = Business Administration
617466,BEDRETTİN TÜRKER PALAMUTÇUOĞLU,2020,Şehir içi toplu taşıma planlamasında akıllı kart veri madenciliği ile sefer sıklığı optimizasyonu,Manisa Celal Bayar Üniversitesi,Türkçe,Doktora,Ulaşım = Transportation ; İşletme = Business Administration
667563,ELİF ÖZTAD,2020,Veri madenciliği ile otizm belirlenmesi,İstanbul Aydın Üniversitesi,Türkçe,Yüksek Lisans,Bilgisayar Mühendisliği Bilimleri-Bilgisayar ve Kontrol = Computer Engineering and Computer Science and Control
638039,KÜBRA ÇOŞAR,2020,OECD sağlık verilerinin veri madenciliği yöntemleri ile analizi,Marmara Üniversitesi,Türkçe,Yüksek Lisans,Bilgisayar Mühendisliği Bilimleri-Bilgisayar ve Kontrol = Computer Engineering and Computer Science and Control
700346,SEDA BALTA,2020,Bir abonenin elektrik tüketim verilerinin veri madenciliği yöntemleri ile analiz edilmesi ve doğru tarifenin belirlenmesi,Sakarya Üniversitesi,Türkçe,Yüksek Lisans,Bilgisayar Mühendisliği Bilimleri-Bilgisayar ve Kontrol = Computer Engineering and Computer Science and Control
640159,SÜMEYYE ÇELİK,2020,Çocuklar için otizm spektrum bozukluğunun veri madenciliği yöntemleri ile analizi,Burdur Mehmet Akif Ersoy Üniversitesi,Türkçe,Yüksek Lisans,Mühendislik Bilimleri = Engineering Sciences ; İşletme = Business Administration
618925,NESLİHAN YEGEN,2020,Perakende sektöründe veri madenciliği ile satış tahmini,Bahçeşehir Üniversitesi,Türkçe,Yüksek Lisans,Bilim ve Teknoloji = Science and Technology
616591,FATMA BETÜL ÖRS,2020,Veri madenciliğinde veri dönüştürme yöntemlerinin sınıflandırma algoritmalarının performanslarına olan etkisi,Trakya Üniversitesi,Türkçe,Yüksek Lisans,Biyoistatistik = Biostatistics
621221,HİKMET ŞEVGİN,2020,ABİDE 2016 fen başarısının yordanmasında MARS ve BRT veri madenciliği yöntemlerinin karşılaştırılması,Gazi Üniversitesi,Türkçe,Doktora,Eğitim ve Öğretim = Education and Training
667460,RAFİA ÖZTOPUZ EREN,2020,Veri madenciliğinde apriori algoritması ve depo düzenleme probleminde satış verileri üzerinden birliktelik analizi,Kocaeli Üniversitesi,Türkçe,Yüksek Lisans,Endüstri ve Endüstri Mühendisliği = Industrial and Industrial Engineering
615186,MUSA ÜNSAL,2020,Ayak vuruş seslerinden veri madenciliği yöntemleri ile kişi tanıma,Kırşehir Ahi Evran Üniversitesi,Türkçe,Yüksek Lisans,Bilgisayar Mühendisliği Bilimleri-Bilgisayar ve Kontrol = Computer Engineering and Computer Science and Control
626170,HASAN TONTUŞ,2020,"Sarf malzeme kullanımından veri madenciliği birliktelik kurallarının elde edilmesi, kuralların analizi ve sınıflandırılması",Gazi Üniversitesi,Türkçe,Yüksek Lisans,Endüstri ve Endüstri Mühendisliği = Industrial and Industrial Engineering
645919,İLYAS YILMAZ,2020,Veri madenciliği sınıflandırma algoritmaları ile yumurtalık kanseri hastalarının incelenmesi: Recep Tayyip Erdoğan Üniversitesi eğitim ve araştırma hastanesi örneği,Recep Tayyip Erdoğan Üniversitesi,Türkçe,Yüksek Lisans,İşletme = Business Administration
689588,YASEMİN HANDE SITKI,2020,Tıp bilişiminde veri madenciliği yöntemleri kullanılarak hastalıkların tahmin edilmesi,Hacettepe Üniversitesi,Türkçe,Yüksek Lisans,İstatistik = Statistics
642239,ERDEM GÜNGÖR,2020,Ülkelerin ekonomik göstergelerinin veri madenciliği analizi,Orta Doğu Teknik Üniversitesi,İngilizce,Yüksek Lisans,Ekonomi = Economics ; Maliye = Finance
647342,MOHAMMED I.F MANSOUR,2020,Veri madenciliği teknikleri ile meme kanseri tahmini için mammogram görüntülerinin analizi,Sakarya Üniversitesi,İngilizce,Yüksek Lisans,Mekatronik Mühendisliği = Mechatronics Engineering
653485,NURETTİN ÖNER,2020,Hastanelerin finansal ve faaliyet durumlarının veri madenciliği yöntemleri ile değerlendirilmesi,Ankara Üniversitesi,Türkçe,Doktora,Hastaneler = Hospitals ; Sağlık Kurumları Yönetimi = Health Care Management
680116,NEDRET TOSUN,2020,OECD ülkelerinin yaş meyve sebze ithalatının veri madenciliği yöntemleri ile tahminlenmesi,Akdeniz Üniversitesi,Türkçe,Doktora,Ekonometri = Econometrics
625916,MUHAMMET ŞENTÜRK,2020,Veri madenciliği ve karmaşık ağ analizi teknikleriyle satın alma siparişi verilerinin analizi,Maltepe Üniversitesi,Türkçe,Yüksek Lisans,Bilgisayar Mühendisliği Bilimleri-Bilgisayar ve Kontrol = Computer Engineering and Computer Science and Control ; Bilim ve Teknoloji = Science and Technology ; Mühendislik Bilimleri = Engineering Sciences
617160,ERDEM KARAASLAN,2019,Elektronik veritabanlarının veri madenciliği yöntemi ile analize edilmesi,Bahçeşehir Üniversitesi,Türkçe,Yüksek Lisans,Bilgi ve Belge Yönetimi = Information and Records Management
552837,KIYMET KAYA,2019,Veri madenciliği yöntemleri kullanarak hava kirliliği tahmini,İstanbul Teknik Üniversitesi,Türkçe,Yüksek Lisans,Bilgisayar Mühendisliği Bilimleri-Bilgisayar ve Kontrol = Computer Engineering and Computer Science and Control
557477,İREM DELİİSMAİL,2019,Veri madenciliği teknikleri kullanılarak internetten alışveriş yapan tüketicilerin analizi,Sakarya Üniversitesi,Türkçe,Yüksek Lisans,Endüstri ve Endüstri Mühendisliği = Industrial and Industrial Engineering
573114,ERGİN UĞURLU,2019,Tam koşullu üretim benzetim modellemesi ile veri madenciliği teknikleri kullanılarak kestirimci bakım ve makine öğrenmesi analizleri,İzmir Katip Çelebi Üniversitesi,Türkçe,Yüksek Lisans,Bilgisayar Mühendisliği Bilimleri-Bilgisayar ve Kontrol = Computer Engineering and Computer Science and Control ; Elektrik ve Elektronik Mühendisliği = Electrical and Electronics Engineering ; Mühendislik Bilimleri = Engineering Sciences
573456,AYLİN SABANCI BAYRAMOĞLU,2019,Nanofiber kaplı filtre malzemelerinin kalite standartlarının belirlenmesinde veri madenciliği,Pamukkale Üniversitesi,Türkçe,Yüksek Lisans,Bilgisayar Mühendisliği Bilimleri-Bilgisayar ve Kontrol = Computer Engineering and Computer Science and Control
573449,FİKRİYE ERDOĞAN,2019,Türkiye\'de lisans düzeyindeki istatistik ders içeriklerinin veri madenciliği yöntemleri ile analizi,Çukurova Üniversitesi,Türkçe,Yüksek Lisans,İstatistik = Statistics
561934,BÜŞRA DAĞCI,2019,Kalite iyileştirme sürecinde hata türü ve etkilerinin analizi ve hataların veri madenciliği ile araştırılması: Talaşlı imalat sektöründe bir uygulama,Karabük Üniversitesi,Türkçe,Yüksek Lisans,Endüstri ve Endüstri Mühendisliği = Industrial and Industrial Engineering
559573,SÜLEYMAN ÖZER,2019,Büyük veri teknolojileri ve veri madenciliği yöntemleri ile medikal veri analizi,Marmara Üniversitesi,Türkçe,Yüksek Lisans,Bilgisayar Mühendisliği Bilimleri-Bilgisayar ve Kontrol = Computer Engineering and Computer Science and Control
549607,NİHAL ZUHAL KAYALI,2019,Öğrencilerde alkollü içecek kullanımının veri madenciliği yöntemleri ile incelenmesi,Sakarya Üniversitesi,Türkçe,Yüksek Lisans,Bilgisayar Mühendisliği Bilimleri-Bilgisayar ve Kontrol = Computer Engineering and Computer Science and Control
602488,NİHAN GÜLSOY,2019,Kredi skorlama süreçlerinde veri madenciliği ve bankacılık sektöründe bir uygulama,Erciyes Üniversitesi,Türkçe,Doktora,Endüstri ve Endüstri Mühendisliği = Industrial and Industrial Engineering
536188,HALİL YILDIZ,2019,Finans sektöründe veri madenciliği kredi skorlama,Milli Savunma Üniversitesi,Türkçe,Yüksek Lisans,Endüstri ve Endüstri Mühendisliği = Industrial and Industrial Engineering
549742,SADİ ELASAN,2019,Veri madenciliğinde farklı karar ağaçları ve k-en yakın komşuluk yöntemlerinin incelenmesi: kadın hastalıkları ve doğum verisinde bir uygulama,Van Yüzüncü Yıl Üniversitesi,Türkçe,Doktora,Biyoistatistik = Biostatistics
561376,KAMİL İLHAN,2019,Uyumsoft CRM sisteminin veri madenciliği ile analiz edilmesi,Sakarya Üniversitesi,Türkçe,Yüksek Lisans,Endüstri ve Endüstri Mühendisliği = Industrial and Industrial Engineering
597959,ÖZGÜR YILDIZ,2019,Kazı destek yapılarının veri madenciliği ilkeleri ile incelenmesi,Yıldız Teknik Üniversitesi,Türkçe,Doktora,İnşaat Mühendisliği = Civil Engineering
597158,MAHMUT COŞKUN,2019,Hanehalkı bilişim teknolojileri kullanımının veri madenciliği teknikleri ile analizi,Gazi Üniversitesi,Türkçe,Yüksek Lisans,Bilim ve Teknoloji = Science and Technology ; Mühendislik Bilimleri = Engineering Sciences
611125,EMİNE RUMEYSA GÜLER,2019,Enerji tüketimi verileri üzerinde akan veri madenciliği uygulaması,Gazi Üniversitesi,Türkçe,Yüksek Lisans,Bilgisayar Mühendisliği Bilimleri-Bilgisayar ve Kontrol = Computer Engineering and Computer Science and Control
606191,YASİN AFŞİN,2019,Müşteri ilişkileri yönetiminde veri madenciliği durum analizi: Hava yolu şirketinde bir uygulama,Mimar Sinan Güzel Sanatlar Üniversitesi,Türkçe,Yüksek Lisans,İstatistik = Statistics
536203,LEVENT YALÇIN,2019,Sağlık sektöründe veri madenciliği,Milli Savunma Üniversitesi,Türkçe,Yüksek Lisans,Mühendislik Bilimleri = Engineering Sciences
600847,YUNUS EMRE CEBECİ,2019,Hava durumu tahmini için veri madenciliği tabanlı bir model geliştirilmesi,İstanbul Teknik Üniversitesi,Türkçe,Yüksek Lisans,Bilgisayar Mühendisliği Bilimleri-Bilgisayar ve Kontrol = Computer Engineering and Computer Science and Control
596815,SÜLEYMAN MUHAMMED ARIKAN,2019,Veri madenciliği temelli siber tehdit istihbaratı,Gazi Üniversitesi,Türkçe,Yüksek Lisans,Bilim ve Teknoloji = Science and Technology ; Mühendislik Bilimleri = Engineering Sciences
570179,MUHAMMED FATİH ŞİMŞEK,2019,Veri madenciliği sınıflandırma tekniklerini kullanarak üretim sistemlerinde hatalı ürünlerin tespit edilmesi,Kırıkkale Üniversitesi,Türkçe,Yüksek Lisans,Endüstri ve Endüstri Mühendisliği = Industrial and Industrial Engineering
595734,MUHAMMED CİHAD TUNA,2019,Kötü niyetli alan adlarının veri madenciliği kullanılarak tespit edilmesi,İstanbul Teknik Üniversitesi,Türkçe,Yüksek Lisans,Bilgisayar Mühendisliği Bilimleri-Bilgisayar ve Kontrol = Computer Engineering and Computer Science and Control
586526,MEHMET ANIL ATLI,2019,Veri madenciliği teknikleri yardımıyla baz istasyonu arızalarının tahmin edilmesi,Bahçeşehir Üniversitesi,Türkçe,Yüksek Lisans,Mühendislik Bilimleri = Engineering Sciences
554898,ABDOULAZIZ ABDOUKARIM,2019,Doğal dil işleme ve veri madenciliği  kullanarak tvitler üzerinden film derecelendirilmesi,Selçuk Üniversitesi,Türkçe,Yüksek Lisans,Bilgisayar Mühendisliği Bilimleri-Bilgisayar ve Kontrol = Computer Engineering and Computer Science and Control
599223,NİHAL YAŞASINOĞLU,2019,Türkiye\'de anlaşmalı boşanma ile sosyal güvenlik kurumundan aylık alanlar üzerine veri madenciliği cart algoritması uygulaması,Gazi Üniversitesi,Türkçe,Yüksek Lisans,İstatistik = Statistics
610114,AYTEN MERMER,2019,Veri madenciliği yaklaşımı ile proje başvuru yapma eğiliminin tahmini,Gazi Üniversitesi,Türkçe,Yüksek Lisans,Endüstri ve Endüstri Mühendisliği = Industrial and Industrial Engineering
573713,OSMAN KAYHAN,2019,Uzaktan eğitim öğrencilerin mezuniyet durumlarının veri madenciliği yöntemleri ile tahmini: Amasya Üniversitesi Örneği,Amasya Üniversitesi,Türkçe,Yüksek Lisans,Bilgisayar Mühendisliği Bilimleri-Bilgisayar ve Kontrol = Computer Engineering and Computer Science and Control ; Eğitim ve Öğretim = Education and Training
570076,TAHİR ERŞAN ŞANLI,2019,Endüstri mühendisliği alanındaki lisansüstü tezlerin veri madenciliği ile çalışma konu önceliklerinin belirlenmesi,Çukurova Üniversitesi,Türkçe,Yüksek Lisans,Endüstri ve Endüstri Mühendisliği = Industrial and Industrial Engineering
560035,BÜŞRA YETGİNLER,2019,Rahim ağzı kanserinin veri madenciliği yöntemleri ile sınıflandırılması,Kırıkkale Üniversitesi,Türkçe,Yüksek Lisans,Bilgisayar Mühendisliği Bilimleri-Bilgisayar ve Kontrol = Computer Engineering and Computer Science and Control
555287,ORAL KILINÇ,2019,Yatırım planlamasında meteorolojik veriler ile veri madenciliği kümeleme uygulamaları,Milli Savunma Üniversitesi,Türkçe,Yüksek Lisans,Bilgisayar Mühendisliği Bilimleri-Bilgisayar ve Kontrol = Computer Engineering and Computer Science and Control ; Meteoroloji = Meteorology ; İşletme = Business Administration
582553,AKINER KAÇMAZ,2019,Mesleki ve teknik eğitim öğrencilerinin teknoloji bağımlılıklarının veri madenciliği ile analizi,Marmara Üniversitesi,Türkçe,Yüksek Lisans,Bilgisayar Mühendisliği Bilimleri-Bilgisayar ve Kontrol = Computer Engineering and Computer Science and Control
579457,BARIŞ YILDIRIM,2019,Modern perakendecilik sektöründe veri madenciliği tekniklerinin uygulanması,İstanbul Üniversitesi-Cerrahpaşa,Türkçe,Yüksek Lisans,Endüstri ve Endüstri Mühendisliği = Industrial and Industrial Engineering ; İstatistik = Statistics ; İşletme = Business Administration
558658,OLCAYTU TOKER,2019,Veri madenciliği yaklaşımını kullanarak koordineli envanter yönetiminin analizi ve uygulaması,Milli Savunma Üniversitesi,Türkçe,Yüksek Lisans,Endüstri ve Endüstri Mühendisliği = Industrial and Industrial Engineering
611169,ERDAL ALBAYRAK,2019,ATM yer seçiminde başlıca veri madenciliği teknikleri ile tahminleme,Maltepe Üniversitesi,Türkçe,Yüksek Lisans,Endüstri ve Endüstri Mühendisliği = Industrial and Industrial Engineering
662759,GÜLBEN GÖRGÜN ÖZŞAHİN,2019,E-ticaret fiyatlandırmasında yapay zeka ve veri madenciliğine dayalı sistem önerisi,Osmaniye Korkut Ata Üniversitesi,Türkçe,Yüksek Lisans,Bilgisayar Mühendisliği Bilimleri-Bilgisayar ve Kontrol = Computer Engineering and Computer Science and Control
559119,SİNAN DURU,2019,Veri madenciliği yöntemleri ve türk müziği analizlerinde kullanılması üzerine bir uygulama,Çukurova Üniversitesi,Türkçe,Yüksek Lisans,Endüstri ve Endüstri Mühendisliği = Industrial and Industrial Engineering
617123,ALİ BURAK SAYILAN,2019,Veri madenciliğinde bazı kümeleme algoritmalarının karşılaştırılması,Muğla Sıtkı Koçman Üniversitesi,Türkçe,Yüksek Lisans,İstatistik = Statistics
538097,ŞERİFE ŞEKER ELMAS,2019,Sosyal medya mesajlarının veri madenciliği yöntemi ile duygu analizi (Sivas ili örneği),Sivas Cumhuriyet Üniversitesi,Türkçe,Yüksek Lisans,Bilgisayar Mühendisliği Bilimleri-Bilgisayar ve Kontrol = Computer Engineering and Computer Science and Control ; Bilim ve Teknoloji = Science and Technology ; İletişim Bilimleri = Communication Sciences
614088,HASAN ÇAKMAK,2019,"Güncel iş kazaları ham verilerinin, veri madenciliği süreci ile analizi",Gazi Üniversitesi,Türkçe,Yüksek Lisans,Endüstri ve Endüstri Mühendisliği = Industrial and Industrial Engineering
551263,AHMET KARABACAK,2019,Türk karasularında meydana gelen gemi kazalarının analizi: Bir veri madenciliği uygulaması,Dokuz Eylül Üniversitesi,Türkçe,Yüksek Lisans,Denizcilik = Marine ; Kazalar = Accidents ; İşletme = Business Administration
576723,MERVE KAYMAZ,2019,Veri madenciliği yöntemi ile risklerin yönetilmesi ve sigorta sektörü üzerine bir uygulama,Marmara Üniversitesi,Türkçe,Yüksek Lisans,Sigortacılık = Insurance ; İşletme = Business Administration
547220,ALİ KÜSMÜŞ,2019,Kan ve antropometri değerlerinden veri madenciliği yöntemleri kullanılarak meme kanseri tahmini,Kahramanmaraş Sütçü İmam Üniversitesi,Türkçe,Yüksek Lisans,Bilgisayar Mühendisliği Bilimleri-Bilgisayar ve Kontrol = Computer Engineering and Computer Science and Control ; Bilim ve Teknoloji = Science and Technology
567928,HÜSEYİN ERKİN SÜLEKLİ,2019,Yoğun bakım ünitelerinde yatan hastalara ilişkin mortalite ve yatış süresine etki eden faktörlerin veri madenciliği yöntemleri ile incelenmesi,Hacettepe Üniversitesi,Türkçe,Yüksek Lisans,Biyoistatistik = Biostatistics
571537,FATİH AŞIK,2019,Böbrek nakli yapılan hastalarda veri madenciliği yöntemleri ile akut rejeksiyon durumunun incelenmesi,Akdeniz Üniversitesi,Türkçe,Yüksek Lisans,Biyoistatistik = Biostatistics ; Nefroloji = Nephrology
572189,DİDEM ATİKTÜRK TAŞDELEN,2019,Veri madenciliğinin tıp ve sağlık hizmetlerinde uygulamaları,Ankara Üniversitesi,Türkçe,Yüksek Lisans,Bilgisayar Mühendisliği Bilimleri-Bilgisayar ve Kontrol = Computer Engineering and Computer Science and Control
577626,YUSUF ALTINOK,2019,Veri madenciliğinde hiyerarşik kümeleme algoritmalarının uygulamalı karşılaştırılması,Marmara Üniversitesi,Türkçe,Yüksek Lisans,Ekonometri = Econometrics ; İstatistik = Statistics
581744,ABDULLAH AKGÜN,2019,Veri madenciliği sınıflandırma yöntemlerinin etkinliğinin karşılaştırılmalı olarak incelenmesi: Seyahat acentası örneği,Akdeniz Üniversitesi,Türkçe,Doktora,Turizm = Tourism ; İşletme = Business Administration
582493,NURİYE TOPYILDIZ,2019,Veri madenciliği sınıflandırma yöntemlerinden karar ağaçları ve bir uygulama,Selçuk Üniversitesi,Türkçe,Yüksek Lisans,İstatistik = Statistics
550279,YUSUF TORUN,2019,Küresel girişimcilik endeksine göre ülkelerin veri madenciliği yöntemleri ile sınıflandırılması,Trakya Üniversitesi,Türkçe,Yüksek Lisans,İşletme = Business Administration
568561,MERVE KAŞIKCI,2019,Transkriptom veri seti üzerinde derin öğrenme yöntemi ile klasik veri madenciliği yöntemlerinin sınıflama performanslarının karşılaştırılması,Hacettepe Üniversitesi,Türkçe,Yüksek Lisans,Biyoistatistik = Biostatistics
598685,BETİM ÇELİK,2019,Mekanik arızaların veri madenciliği Apriori algoritması ile analiz edilmesi,Kocaeli Üniversitesi,Türkçe,Yüksek Lisans,Endüstri ve Endüstri Mühendisliği = Industrial and Industrial Engineering
604127,MEHMET SEZER,2019,Patent analizi ve veri madenciliğine dayalı teknoloji değerlendirmesi,Yıldız Teknik Üniversitesi,Türkçe,Yüksek Lisans,Endüstri ve Endüstri Mühendisliği = Industrial and Industrial Engineering
582711,HATİCE BOLAT,2019,Kayseri il emniyet müdürlüğü trafik kaza verilerinin veri madenciliği yaklaşımları ile analizi,Erciyes Üniversitesi,Türkçe,Yüksek Lisans,Endüstri ve Endüstri Mühendisliği = Industrial and Industrial Engineering
587981,SEMA PEÇE,2019,İşletme bölümü lisans derslerinin veri madenciliği yöntemleri ile analizi: Recep Tayyip Erdoğan Üniversitesi örneği,Recep Tayyip Erdoğan Üniversitesi,Türkçe,Yüksek Lisans,İşletme = Business Administration
563568,AHMET GÖKHAN GÜREL,2019,Üniversite kütüphanesi verileri üzerinde veri madenciliği yöntemlerinin uygulanması,Afyon Kocatepe Üniversitesi,Türkçe,Yüksek Lisans,Bilgisayar Mühendisliği Bilimleri-Bilgisayar ve Kontrol = Computer Engineering and Computer Science and Control
618509,NUR GİZEM AK,2019,Eğitsel veri madenciliğindeki eğilimlerin çok yönlü incelenmesi,Hatay Mustafa Kemal Üniversitesi,Türkçe,Yüksek Lisans,Eğitim ve Öğretim = Education and Training
539274,BÜŞRA YILDIZ KORKMAZ,2019,Bir havayolu işletmesinde kabin ekiplerinin performans değerlendirmesine ilişkin bir veri madenciliği uygulaması,Gazi Üniversitesi,Türkçe,Yüksek Lisans,Endüstri ve Endüstri Mühendisliği = Industrial and Industrial Engineering
570970,ZAHİDE DENİZLİ,2019,Veri madenciliği modelleri ve örnek bir uygulama,Dokuz Eylül Üniversitesi,Türkçe,Yüksek Lisans,Ekonometri = Econometrics
582734,SEREN SEZEN KARALÖK,2019,Alternatif sosyal katmaların bilişsel alışveriş sepetlerinin veri madenciliği ile incelenmesi ve uygulanması,Kırıkkale Üniversitesi,Türkçe,Yüksek Lisans,Endüstri ve Endüstri Mühendisliği = Industrial and Industrial Engineering
542902,YAVUZ OĞUZ İPEK,2019,Şirket misyon ve vizyon bilgilerinin veri madenciliği yöntemiyle incelenerek işletme performansı göstergeleri ile ilişkilendirilmesi,Bahçeşehir Üniversitesi,Türkçe,Yüksek Lisans,İşletme = Business Administration
543604,NİHAN MÜNİSE KAZAZ,2019,Veri madenciliğinde kümeleme analizi yöntemlerinin incelenmesi ve sağlık bilimleri alanındaki uygulamaları,İstanbul Üniversitesi,Türkçe,Yüksek Lisans,Biyoistatistik = Biostatistics
555459,FİKRET UMUT AYDIN,2019,Okullardaki gürültüyü etkileyen faktörlerin veri madenciliği ve deneysel tasarım ile analizi,Bursa Uludağ Üniversitesi,Türkçe,Yüksek Lisans,Endüstri ve Endüstri Mühendisliği = Industrial and Industrial Engineering
601842,BİRSEN RENCÜZOĞULLARI,2019,Veri madenciliğinde birliktelik kuralı ve hepatit hastalığı üzerine bir uygula,Eskişehir Teknik Üniversitesi,Türkçe,Yüksek Lisans,İstatistik = Statistics
578203,ABDURRAHMAN YAKUPOĞLU,2019,Veri madenciliği ile üniversite bilişim teknik servis hizmetleri analizi,Düzce Üniversitesi,Türkçe,Yüksek Lisans,Bilgisayar Mühendisliği Bilimleri-Bilgisayar ve Kontrol = Computer Engineering and Computer Science and Control
537732,ÖZİN KALEMCİ,2019,Veri madenciliği yöntemi ile prostat kanseri için erken uyarı protokollerinin geliştirilmesi,İstanbul Üniversitesi,Türkçe,Doktora,Biyoistatistik = Biostatistics ; İstatistik = Statistics ; İşletme = Business Administration
