Tez No,Yazar,Yıl,Tez Adı,Üniversite,Dil,Tez Türü,Konu
139336,SELMİN DANIŞ,2003,Using data mining to reduce false positivies for pre-biopsy patients with moderate chance of having prostate cancer,Boğaziçi Üniversitesi,İngilizce,Yüksek Lisans,Bilgisayar Mühendisliği Bilimleri-Bilgisayar ve Kontrol = Computer Engineering and Computer Science and Control ; Endüstri ve Endüstri Mühendisliği = Industrial and Industrial Engineering ; Üroloji = Urology
154952,OLGA UFUK GÖREN,2003,Data mining techniques for customer relationship management: A case study for Doğuş otomotiv,Işık Üniversitesi,İngilizce,Yüksek Lisans,Bilgisayar Mühendisliği Bilimleri-Bilgisayar ve Kontrol = Computer Engineering and Computer Science and Control
121710,LÜTFÜ YILMAZ,2002,A Decision support system using data mining an application in TMA,Yeditepe Üniversitesi,İngilizce,Yüksek Lisans,Bilgisayar Mühendisliği Bilimleri-Bilgisayar ve Kontrol = Computer Engineering and Computer Science and Control
121008,BELGİN ÖZAKAR,2002,Finding and evaluating patterns in web repository using database technology and data mining algorithms,İzmir Yüksek Teknoloji Enstitüsü,İngilizce,Yüksek Lisans,Bilgisayar Mühendisliği Bilimleri-Bilgisayar ve Kontrol = Computer Engineering and Computer Science and Control
111052,BERİL SİPAHİ,2002,Data mining in customer relation ship management: Model building and application in automotive industry,Marmara Üniversitesi,İngilizce,Doktora,İşletme = Business Administration
112063,EDA GÜVENÇ,2001,Student performance assessment in higher education using data mining,Boğaziçi Üniversitesi,İngilizce,Yüksek Lisans,Endüstri ve Endüstri Mühendisliği = Industrial and Industrial Engineering
104220,ALİ ALKAN,2001,Predictive data mining with neural networks and genetic algorithms,İstanbul Teknik Üniversitesi,İngilizce,Yüksek Lisans,Savunma ve Savunma Teknolojileri = Defense and Defense Technologies
112559,ESRA SATIROĞLU,2001,Mining user access patterns and identity information from web logs for effective personalization,İhsan Doğramacı Bilkent Üniversitesi,İngilizce,Yüksek Lisans,Bilgisayar Mühendisliği Bilimleri-Bilgisayar ve Kontrol = Computer Engineering and Computer Science and Control
112183,MEHMET AYDIN ULAŞ,2001,Market basket analysis for data mining,Boğaziçi Üniversitesi,İngilizce,Yüksek Lisans,Bilgisayar Mühendisliği Bilimleri-Bilgisayar ve Kontrol = Computer Engineering and Computer Science and Control
93044,MELİHA YETİŞGEN,2000,Data mining using queny flocks with views,Orta Doğu Teknik Üniversitesi,İngilizce,Yüksek Lisans,Bilgisayar Mühendisliği Bilimleri-Bilgisayar ve Kontrol = Computer Engineering and Computer Science and Control
83826,MEHMET SEVAL KAYGULU,1999,Supervised and unsupervised learning techniques in data mining,Dokuz Eylül Üniversitesi,İngilizce,Yüksek Lisans,Bilgisayar Mühendisliği Bilimleri-Bilgisayar ve Kontrol = Computer Engineering and Computer Science and Control
883838,SELÇUK KURT,2024,Meteorolojik ölçüm verilerinin regresyon yaklaşımı ile modellenmesinde veri madenciliği aşamaları ve kullanımı,Muğla Sıtkı Koçman Üniversitesi,Türkçe,Yüksek Lisans,Meteoroloji = Meteorology
881735,AYŞEGÜL BOZDAĞ KASAP,2024,Yüksek riskli sınavlarda başarıyla ilişkili değişkenlerin veri madenciliği yöntemleriyle incelenmesi,Gazi Üniversitesi,Türkçe,Doktora,Eğitim ve Öğretim = Education and Training
888993,MURAT ÇETİN,2024,Sağlık işletmelerinde veri madenciliği uygulamaları,Erzincan Binali Yıldırım Üniversitesi,Türkçe,Yüksek Lisans,İşletme = Business Administration
875714,TUĞBA TÜLEGEN,2024,Finansal raporlamada hile riskinin tespit edilmesinde veri madenciliğinin etkinliği,Tokat Gaziosmanpaşa Üniversitesi,Türkçe,Doktora,İşletme = Business Administration
889641,SERHAT YILMAZ,2024,Betonarme ve yığma yapılarda deprem kaynaklı gözlemsel harsar tespit ve süreçte veri madenciliği,İzmir Demokrasi Üniversitesi,Türkçe,Yüksek Lisans,İnşaat Mühendisliği = Civil Engineering
894445,BARIŞ ŞAYBAK,2024,PISA 2022 Türkiye örnekleminde bilgi ve iletişim teknolojisi kaynakları kullanımının okuma performansını yordama durumunun veri madenciliği teknikleriyle incelenmesi,Bursa Uludağ Üniversitesi,Türkçe,Yüksek Lisans,Eğitim ve Öğretim = Education and Training
895044,MELEK ERTUĞ YILDIRIM,2024,Kocaeli Akçaray ulaşım sisteminin bakım ve onarım süreçlerinin veri madenciliği ile analizi,Kocaeli Üniversitesi,Türkçe,Yüksek Lisans,Bilgisayar Mühendisliği Bilimleri-Bilgisayar ve Kontrol = Computer Engineering and Computer Science and Control
896276,SABAHATTİN NUR,2024,Sermaye piyasalarında veri madenciliği uygulamaları: Borsa İstanbul örneği,İskenderun Teknik Üniversitesi,Türkçe,Yüksek Lisans,Ekonomi = Economics
897666,İBRAHİM KARAASLAN,2024,İmar uygulamalarında veri madenciliği tabanlı yöntemlerin kullanılması,Kayseri Üniversitesi,Türkçe,Yüksek Lisans,Mühendislik Bilimleri = Engineering Sciences
899661,HAFİZE ŞENYIL,2024,Müşteri ilişkileri yönetimde veri madenciliği: Bir bankanın kredi müşterilerine yönelik uygulama,Konya Gıda ve Tarım Üniversitesi,Türkçe,Yüksek Lisans,Endüstri ve Endüstri Mühendisliği = Industrial and Industrial Engineering
900651,SEFA BAYRAKTAR,2024,Veri madenciliği yöntemleri ile bilgi merkezi verilerinden bilgi keşfi,Burdur Mehmet Akif Ersoy Üniversitesi,Türkçe,Yüksek Lisans,Bilgi ve Belge Yönetimi = Information and Records Management ; Yönetim Bilişim Sistemleri = Management Information Systems
892377,MERVE YENEN,2024,Veri madenciliği kullanarak ache enzimiyle etkileşen moleküllerin bağlanma eğiliminin tahmini,Necmettin Erbakan Üniversitesi,Türkçe,Yüksek Lisans,Bilgisayar Mühendisliği Bilimleri-Bilgisayar ve Kontrol = Computer Engineering and Computer Science and Control
902589,SABAHATTİN MERT BERKMEN,2024,Akaryakıt sektöründe işlem anormalliklerinin veri madenciliği yöntemleri ile sınıflandırılması,İSTANBUL BEYKENT ÜNİVERSİTESİ,Türkçe,Yüksek Lisans,Endüstri ve Endüstri Mühendisliği = Industrial and Industrial Engineering
904671,FATMA DİDEM ALAY,2024,Fotovoltaik enerji sistemleri için öngörü modellerinin geliştirilmesi: Veri madenciliği ve derin öğrenme yaklaşımları,Harran Üniversitesi,Türkçe,Doktora,Bilgisayar Mühendisliği Bilimleri-Bilgisayar ve Kontrol = Computer Engineering and Computer Science and Control ; Elektrik ve Elektronik Mühendisliği = Electrical and Electronics Engineering
906013,PINAR KARABAKLA,2024,EEG sinyallerinin veri madenciliği teknikleriyle değerlendirilmesi,Gazi Üniversitesi,Türkçe,Yüksek Lisans,Eğitim ve Öğretim = Education and Training
906031,SELMA TOSUN,2024,Açıköğretim öğrencilerinin okul terkine etki eden faktörlerin veri madenciliği ile keşfi,Gazi Üniversitesi,Türkçe,Doktora,Eğitim ve Öğretim = Education and Training
911201,MUHAMMET ALİ KAYA,2024,Sağlık işletmelerinde veri madenciliği ile hasta profillerinin tespiti için bir simülasyon uygulaması,Necmettin Erbakan Üniversitesi,Türkçe,Yüksek Lisans,İşletme = Business Administration
849096,MOHAMMED DAHAN AHMED ABDULRAB AL-WAJIH,2024,Çevrimiçi yemek siparişinde veri madenciliği ve istatistiksel yöntemler ile tüketici algı ve beklentilerini etkileyen faktörlerin araştırılması,Karabük Üniversitesi,Türkçe,Yüksek Lisans,Endüstri ve Endüstri Mühendisliği = Industrial and Industrial Engineering
850221,ENVER ENGÜR,2024,Veri madenciliğinde sınıflandırma problemleri için optimizasyon yaklaşımları,Erciyes Üniversitesi,Türkçe,Doktora,Endüstri ve Endüstri Mühendisliği = Industrial and Industrial Engineering
851202,FEVZİ KARACA,2024,Öğrencilerin teknoloji kullanımı alışkanlıklarının ve bilişim okuryazarlıklarının PISA test sonuçlarıyla olan ilişkisinin veri madenciliği yöntemleriyle incelenmesi,Burdur Mehmet Akif Ersoy Üniversitesi,Türkçe,Yüksek Lisans,Eğitim ve Öğretim = Education and Training ; Yönetim Bilişim Sistemleri = Management Information Systems
852892,İSMAİL BURAK AKINCI,2024,"Demir çelik sektöründeki ürünlerin görüntü işleme, veri madenciliği yöntemleriyle tespiti ve karar destek sisteminin oluşturulması",Karabük Üniversitesi,Türkçe,Doktora,Endüstri ve Endüstri Mühendisliği = Industrial and Industrial Engineering
853217,BÜŞRA TUNÇMAN,2024,Tekstil sektöründe iş kazalarına neden olan risk faktörlerinin veri madenciliği yöntemleriyle değerlendirilmesi,Bursa Uludağ Üniversitesi,Türkçe,Yüksek Lisans,Bilgisayar Mühendisliği Bilimleri-Bilgisayar ve Kontrol = Computer Engineering and Computer Science and Control ; Bilim ve Teknoloji = Science and Technology ; Endüstri ve Endüstri Mühendisliği = Industrial and Industrial Engineering
853234,COŞKAN SEVGİLİ,2024,Gemi denetim sonuçlarının veri madenciliği yöntemleriyle analizi: Türk bayraklı gemiler üzerine bir uygulama,Dokuz Eylül Üniversitesi,Türkçe,Doktora,Denizcilik = Marine ; Gemi Mühendisliği = Marine Engineering
848444,AYŞE SEDA BALKAN,2024,Türkiye\'de konut satış sayılarının veri madenciliği yöntemleri ile tahmini,Toros Üniversitesi,Türkçe,Yüksek Lisans,Mimarlık = Architecture
855245,EMRE TURGUT,2024,Kentsel dönüşüm uygulamalarında daire belirleme işlemlerinin mekânsal veri madenciliği yöntemleri ile belirlenmesi,Kayseri Üniversitesi,Türkçe,Yüksek Lisans,Mühendislik Bilimleri = Engineering Sciences
855658,DAMLA HALATCI,2024,Veri madenciliği yöntemlerinin diyabet tahmininde kullanılması,Bahçeşehir Üniversitesi,Türkçe,Yüksek Lisans,Bilgisayar Mühendisliği Bilimleri-Bilgisayar ve Kontrol = Computer Engineering and Computer Science and Control
856845,EROKAN CANBAZOĞLU,2024,Veri madenciliği teknikleri ile sağlık turizminde rezervasyon iptallerinin tahmini,Akdeniz Üniversitesi,Türkçe,Doktora,Ekonometri = Econometrics
857661,FERDİ KARAKÜTÜK,2024,Veri madenciliği algoritmaları ile aile yapısı araştırması verilerinin sınıflandırılması,Eskişehir Teknik Üniversitesi,Türkçe,Yüksek Lisans,İstatistik = Statistics
859522,MERYEM ERDOĞAN,2024,Havacılık endüstrisinde prognostik sağlık yönetimi ve veri madenciliği,Yıldız Teknik Üniversitesi,Türkçe,Yüksek Lisans,Bilgisayar Mühendisliği Bilimleri-Bilgisayar ve Kontrol = Computer Engineering and Computer Science and Control ; Havacılık ve Uzay Mühendisliği = Aeronautical Engineering ; Uçak Mühendisliği = Aeronautical Engineering
860372,BERRİN DEĞİRMENCİ,2024,Yurtta barınan öğrencilerin ayrılma sebeplerinin veri madenciliği yöntemleriyle analiz edilmesi,Gazi Üniversitesi,Türkçe,Yüksek Lisans,Bilgisayar Mühendisliği Bilimleri-Bilgisayar ve Kontrol = Computer Engineering and Computer Science and Control
860955,ZELİHA ÇAĞLA KUYUMCU,2024,Sürücü kaynaklı trafik kazalarının veri madenciliği yaklaşımı ile modellenmesi: Sakarya örneği,Sakarya Üniversitesi,Türkçe,Doktora,Trafik = Traffic ; Ulaşım = Transportation ; İnşaat Mühendisliği = Civil Engineering
863390,AHMET KÜRŞAT AKICI,2024,Veri bilimi meslekleri ve uzmanlık alanları arasındakiilişkilerin veri madenciliği yaklaşımıyla analizi,Karamanoğlu Mehmetbey Üniversitesi,Türkçe,Yüksek Lisans,Yönetim Bilişim Sistemleri = Management Information Systems
863688,MEHMET EMİN ASAN,2024,Veri madenciliği ve makine öğrenmesi yaklaşımı ile tiroit kanserinin tanılanması,Sakarya Üniversitesi,Türkçe,Doktora,Endüstri ve Endüstri Mühendisliği = Industrial and Industrial Engineering
864613,NURİ ERGÜN TANRIÖVER,2024,Hava kalitesi ve meteorolojik etkiler arasındaki ilişkinin regresyon yaklaşımı ile modellemesinde veri madenciliği süreçlerinin kullanımı,Muğla Sıtkı Koçman Üniversitesi,Türkçe,Yüksek Lisans,Meteoroloji = Meteorology
864848,RABİA KARAHAN,2024,Veri madenciliği kapsamında; dijitalleşme yeni nesil teknolojiler ve finans üzerine etkileri,Gebze Teknik Üniversitesi,Türkçe,Yüksek Lisans,Bankacılık = Banking ; Bilim ve Teknoloji = Science and Technology ; İstatistik = Statistics
866818,SÜMEYYE GÜNDÜZ,2024,Veri madenciliği yöntemleri ile dokümantasyon süreçlerinin iyileştirilmesi: Havacılık sektöründe bir vaka çalışması,İstanbul Üniversitesi-Cerrahpaşa,Türkçe,Yüksek Lisans,Endüstri ve Endüstri Mühendisliği = Industrial and Industrial Engineering
869044,BÜŞRA POLAT,2024,Veri madenciliği yöntemleri ile müşteri memnuniyetinin değerlendirilmesi,Erciyes Üniversitesi,Türkçe,Yüksek Lisans,Endüstri ve Endüstri Mühendisliği = Industrial and Industrial Engineering
869634,ZAFER KARDEŞ,2024,Bağımsız denetim görüşlerinin tahmin edilmesinde veri madenciliği yöntemlerinin karşılaştırılması: Borsa İstanbul\'da bir uygulama,Afyon Kocatepe Üniversitesi,Türkçe,Doktora,İşletme = Business Administration
869819,GAMZE KÖSE,2024,Dental turistlerin memnuniyet durumlarının veri madenciliği ile tahmin edilmesi,Aydın Adnan Menderes Üniversitesi,Türkçe,Yüksek Lisans,Turizm = Tourism
870663,NESİBE MANAV MUTLU,2024,Kadın sporcular üzerine yapılmış bilimsel çalışmalara veri madenciliği ile bakış,Ankara Üniversitesi,Türkçe,Yüksek Lisans,Spor = Sports
871447,CEYHAN TAZEFİDAN,2024,Geleneksel kent dokusunun veri madenciliği yöntemiyle analizi ve yeni yapı tasarımları için yapay zekaya dayalı bir model önerisi,Konya Teknik Üniversitesi,Türkçe,Doktora,Mimarlık = Architecture
855285,ÜMİT ÇELİK,2024,Öğrencilerin LGS tercihlerine göre ortaöğretim kurumlarına yerleşme durumlarının veri madenciliği yaklaşımı ile modellenmesi,Afyon Kocatepe Üniversitesi,Türkçe,Yüksek Lisans,Eğitim ve Öğretim = Education and Training
875199,LALE ŞAHİN,2024,Veri madenciliği yöntemleri kullanılarak su kirliliğinde bulanıklık parametresinin tahmin edilmesi: Sinop ili örneği,Sinop Üniversitesi,Türkçe,Yüksek Lisans,Çevre Mühendisliği = Environmental Engineering
877526,BEYZA DURMAZ,2024,Veri madenciliğinde sınıflandırma ve kümeleme algoritmaları ile COVID-19 şüphesi taşıyan hastaların değerlendirilmesi,Ondokuz Mayıs Üniversitesi,Türkçe,Yüksek Lisans,Endüstri ve Endüstri Mühendisliği = Industrial and Industrial Engineering
880304,ÖZLEM YÜREKLİ,2024,Veri madenciliği ile çalışanların yıpranma durumu tahmini ve kapsamlı performans analizi,Selçuk Üniversitesi,Türkçe,Yüksek Lisans,Yönetim Bilişim Sistemleri = Management Information Systems
880989,ALİ ALSAÇ,2024,Yapay zekâ ve veri madenciliği teknikleriyle müşteri profili tanımlama: Müşteri ilişkileri yönetimi dinamik modelleme uygulaması,İstanbul Üniversitesi-Cerrahpaşa,Türkçe,Doktora,Endüstri ve Endüstri Mühendisliği = Industrial and Industrial Engineering
880668,ÜLKE BALCI YEŞİLKAYA,2024,"STEM tutumu ve kariyerini etkileyen değişkenlerin veri madenciliği yöntemleri ile belirlenmesi, STEM alanlarına ait fenomenlerin gömülü teori deseni ile değerlendirilmesi",Bursa Uludağ Üniversitesi,Türkçe,Doktora,Eğitim ve Öğretim = Education and Training
885755,GÖZDE ULU METİN,2024,Ar-Ge ve tasarım merkezlerinin istatistiksel olarak değerlendirilmesi: Veri madenciliği yöntemleri ile hibrit karar verme,Ankara Üniversitesi,Türkçe,Doktora,İstatistik = Statistics
778488,MEHMET ÇAĞLAR ÜNSAL,2023,Veri madenciliği teknikleri ile Türkiye\'de yaşam memnuniyeti düzeyleri üzerine bir uygulama,Ankara Hacı Bayram Veli Üniversitesi,Türkçe,Doktora,Endüstri ve Endüstri Mühendisliği = Industrial and Industrial Engineering ; Kamu Yönetimi = Public Administration ; İşletme = Business Administration
779271,ŞEYMA IRMAK,2023,"STEM eğitiminin etkisinin sistematik derleme, veri madenciliği ve meta-analiz yoluyla incelenmesi",Hacettepe Üniversitesi,Türkçe,Doktora,Eğitim ve Öğretim = Education and Training
780769,ZAFER HAKLI,2023,Stratejik halkla ilişkiler yönetim sürecinde veri madenciliğinin kullanımı: Süleyman Demirel Üniversitesi örneği,Süleyman Demirel Üniversitesi,Türkçe,Doktora,Halkla İlişkiler = Public Relations ; İşletme = Business Administration
782725,SELCAN KESER,2023,Lisansüstü programlara öğrenci kabulünde kullanılan kriter puanların işlevselliği üzerine bir veri madenciliği çalışması,Bolu Abant İzzet Baysal Üniversitesi,Türkçe,Yüksek Lisans,Eğitim ve Öğretim = Education and Training
784775,GÜRKAN KOLAYLI,2023,Telekomünikasyon sektörünün veri madenciliği yöntemleri ile incelenmesi: Uluslararası Telekomünikasyon Birliği üye ülkeleri örneği,Trakya Üniversitesi,Türkçe,Doktora,Yönetim Bilişim Sistemleri = Management Information Systems ; İletişim Bilimleri = Communication Sciences ; İşletme = Business Administration
840145,AHMET KOÇAK,2023,Sağlık verilerinde veri kalitesi ve sağlık sektöründe veri madenciliği analiz yöntemleri ve uygulama örnekleri,Gazi Üniversitesi,Türkçe,Yüksek Lisans,Yönetim Bilişim Sistemleri = Management Information Systems
840100,SABRİ SERKAN TAN,2023,Öğrenme analitikleri çerçevesinde veri madenciliği yöntemleri ile anlık geri bildirim sisteminin tasarlanması,Atatürk Üniversitesi,Türkçe,Doktora,Eğitim ve Öğretim = Education and Training
842546,AYTAÇ KOCABAŞ,2023,COVID-19 salgınında ilaç ve takviye yöneliminin veri madenciliği yöntemi ile belirlenmesi: Karaman ilinde bir araştırma,Karamanoğlu Mehmetbey Üniversitesi,Türkçe,Yüksek Lisans,Halk Sağlığı = Public Health ; Mikrobiyoloji = Microbiology ; Yönetim Bilişim Sistemleri = Management Information Systems
843720,KEVSER YEŞİLÇİMEN,2023,Akıllı seralardan toplanan verilerin veri madenciliği yöntemleri ile modellenmesi,Burdur Mehmet Akif Ersoy Üniversitesi,Türkçe,Yüksek Lisans,Yönetim Bilişim Sistemleri = Management Information Systems
843751,SEVİNÇ ERDEM TURHAN,2023,Ortaokul öğrencilerinin iklim okuryazarlığına ilişkin görüşlerinin veri madenciliği yöntemleri ile analizi,Burdur Mehmet Akif Ersoy Üniversitesi,Türkçe,Yüksek Lisans,Eğitim ve Öğretim = Education and Training
844496,BURAK ÇAĞLAR,2023,Sosyal medya mesajlarında veri madenciliği ile bilgi keşfi ve görsel analitik ortamda sunulması: COVID-19 tweet veri seti örneği,Necmettin Erbakan Üniversitesi,Türkçe,Doktora,Jeodezi ve Fotogrametri = Geodesy and Photogrammetry ; Mühendislik Bilimleri = Engineering Sciences
844527,DİLAY ŞİMŞEK,2023,Veri madenciliğinde birliktelik kuralı yöntemini kredi kartı kullanan müşteriler üzerinde uygulanması ve power bı\'da raporlanması,Maltepe Üniversitesi,Türkçe,Yüksek Lisans,Bankacılık = Banking ; Bilgisayar Mühendisliği Bilimleri-Bilgisayar ve Kontrol = Computer Engineering and Computer Science and Control ; Endüstri ve Endüstri Mühendisliği = Industrial and Industrial Engineering
774014,ALİ KARAKUŞ,2023,Mobilya sektöründe satış sonrası hizmetler bölümünde veri madenciliği uygulaması,Erciyes Üniversitesi,Türkçe,Yüksek Lisans,Endüstri ve Endüstri Mühendisliği = Industrial and Industrial Engineering
848862,ABDURRAHMAN COŞKUNER,2023,Gayrimenkul yatırım ortaklıklarında kârlılık belirleyicilerinin veri madenciliği yöntemleri ile tahminlemesi: Uluslararası bir karşılaştırma,Gaziantep Üniversitesi,Türkçe,Doktora,İşletme = Business Administration
851601,DİLEK ÖZDEMİR YILMAZ,2023,Endüstri 4.0 kapsamında veri madenciliği yöntemleriyle sevkiyat performansının iyileştirilmesi,Bursa Uludağ Üniversitesi,Türkçe,Doktora,İstatistik = Statistics
859713,İPEK ERDOĞMUŞ,2023,Veri madenciliği sınıflandırma algoritmalarıyla lisans yabancı dil hazırlık programında öğrenmeyi etkileyen faktörlerin belirlenmesi,İstanbul Üniversitesi,Türkçe,Doktora,Bilim ve Teknoloji = Science and Technology ; Eğitim ve Öğretim = Education and Training ; İstatistik = Statistics
779347,AYNUR GÜNAY,2023,Makine öğrenmesi ile veri madenciliği teknikleri kullanılarak anahtar kelime tahmini ve tezlerdeki anahtar kelimelerin doğruluk oranı tespiti,Nişantaşı Üniversitesi,Türkçe,Yüksek Lisans,Bilgisayar Mühendisliği Bilimleri-Bilgisayar ve Kontrol = Computer Engineering and Computer Science and Control
777159,MERVE VİCİR,2023,Jinekolojik kanser hastalarında NANDA hemşirelik tanılarının makine öğrenmesi ve veri madenciliği yöntemi ile geliştirilmesi,Pamukkale Üniversitesi,Türkçe,Yüksek Lisans,Hemşirelik = Nursing ; Kadın Hastalıkları ve Doğum = Obstetrics and Gynecology
867525,AHMET BURSALI,2023,Analitik hiyerarşi süreci ve veri madenciliği teknikleriyle hibrit bir karar destek sistemi uygulaması: kovid19 tanısı,Ege Üniversitesi,Türkçe,Yüksek Lisans,Biyoistatistik = Biostatistics
784774,FATİH BİNGÜL,2023,Yapay zekâ destekli makine öğrenmesi algoritmaları ile eğitsel veri madenciliği alanında öğrenci akademik performanslarının tahmin edilmesi,İstanbul Gedik Üniversitesi,Türkçe,Yüksek Lisans,Mühendislik Bilimleri = Engineering Sciences
783274,FATMANUR DAL,2023,Hastalık teşhis tahminlerinde veri madenciliği sınıflandırma yöntemleri,Süleyman Demirel Üniversitesi,Türkçe,Yüksek Lisans,Biyoistatistik = Biostatistics
787213,MELİH KARAHASANOĞLU,2023,Sağlık sektöründe müşteri kayıp analizi ve veri madenciliği ile bir uygulama,Bursa Uludağ Üniversitesi,Türkçe,Doktora,Sağlık Yönetimi = Healthcare Management ; İşletme = Business Administration
787624,NEVRA YAMAN,2023,Yeniden uçuş çizelgelemede uçuşların veri madenciliği ile analizi ve bir karar destek sistemi önerisi,Gazi Üniversitesi,Türkçe,Doktora,Endüstri ve Endüstri Mühendisliği = Industrial and Industrial Engineering
787771,EMRE KOMAR,2023,Türkiye ve italya Voleybol Süper Ligleri 2013-2020 istatistik verilerinin veri madenciliği yöntemleriyle analizi,Giresun Üniversitesi,Türkçe,Yüksek Lisans,Spor = Sports
787960,SEDA UÇAR,2023,Geyve Devlet Hastanesinde yatan COVID-19 hasta verilerinin veri madenciliği yöntemiyle incelenmesi,Sakarya Üniversitesi,Türkçe,Yüksek Lisans,Bilgisayar Mühendisliği Bilimleri-Bilgisayar ve Kontrol = Computer Engineering and Computer Science and Control
789036,BEYZA NUR DOĞAN,2023,Epicometis (Tropinota) hirta poda (Coleoptera: Scarabaeidae) bireylerinin cinsiyetlerinin veri madenciliği algoritması ile ayrılması,Eskişehir Osmangazi Üniversitesi,Türkçe,Yüksek Lisans,Genetik = Genetics
789065,ADEM KOÇ,2023,Ortaokul mezunlarının ortaöğretimi tamamlama durumlarının veri madenciliği ile tahmini: Trabzon ili örneği,Afyon Kocatepe Üniversitesi,Türkçe,Yüksek Lisans,Bilgisayar Mühendisliği Bilimleri-Bilgisayar ve Kontrol = Computer Engineering and Computer Science and Control ; Eğitim ve Öğretim = Education and Training
790124,SERAY MİRASÇI,2023,Sac malzeme satın alma süreçlerinde veri madenciliği ve makine öğrenmesi uygulamaları,Bursa Uludağ Üniversitesi,Türkçe,Yüksek Lisans,Endüstri ve Endüstri Mühendisliği = Industrial and Industrial Engineering
790347,ESRA ÇETİN,2023,Veri madenciliği ve yapay sinir ağları yöntemleri ile hazır giyim sektöründe talep tahmini,Kocaeli Üniversitesi,Türkçe,Yüksek Lisans,Endüstri ve Endüstri Mühendisliği = Industrial and Industrial Engineering
791685,SEVİM ŞEVVAL ZOROĞLU,2023,Yurt dışı dil eğitim kurumlarında veri madenciliği yöntemi ile hedef kitle belirleme,Sakarya Üniversitesi,Türkçe,Yüksek Lisans,Endüstri ve Endüstri Mühendisliği = Industrial and Industrial Engineering
792867,İPEK DURMAZ,2023,Ebeveynlerin dijital ebeveynlik öz yeterliklerinin veri madenciliği ile değerlendirilmesi,Fırat Üniversitesi,Türkçe,Yüksek Lisans,Eğitim ve Öğretim = Education and Training
794135,SONGÜL YENER,2023,Bir saç ekim merkezine başvuran hastalara uygulanacak tedavilere veri madenciliği yöntemleri ile tahmin edilmesi,İstanbul Medipol Üniversitesi,Türkçe,Yüksek Lisans,Sağlık Yönetimi = Healthcare Management
795907,AHMET EYMEN ÖNCÜ,2023,Jandarma bölgesinde gerçekleşen trafik kazalarının veri madenciliği yöntemiyle analizi,Gazi Üniversitesi,Türkçe,Yüksek Lisans,Trafik = Traffic
797307,HAZAL BADEMCİ,2023,Eğilim skorları tahmininde veri madenciliği yöntemleri: Madencilik sektöründe bir uygulama,Gazi Üniversitesi,İngilizce,Yüksek Lisans,İstatistik = Statistics
798030,SİNEM CEYLAN KONAK,2023,Temel veri madenciliği algoritmalarının başarımlarının endokrin veri seti üzerinde karşılaştırılması,Pamukkale Üniversitesi,Türkçe,Yüksek Lisans,Elektrik ve Elektronik Mühendisliği = Electrical and Electronics Engineering
800641,ZEYNEP EYMİR ÖZTEKİN,2023,Üniversite öğrencilerinde problemli teknoloji kullanımının veri madenciliği yöntemleri ile incelenmesi,Fırat Üniversitesi,Türkçe,Doktora,Eğitim ve Öğretim = Education and Training
804282,OĞUZCAN ULUDAĞ,2023,Finansal durum analizi için veri madenciliği yaklaşımı,Ege Üniversitesi,Türkçe,Doktora,Matematik = Mathematics
805491,AYŞEGÜL NART,2023,Kalp hastalıklarını tahmin etmede veri madenciliğiteknikleriyle etkili algoritmanın tespit edilmesi,Gazi Üniversitesi,Türkçe,Yüksek Lisans,Bilim ve Teknoloji = Science and Technology ; Kardiyoloji = Cardiology
806595,RAMAZAN PEHLİVAN,2023,Veri madenciliğinde kategorik veri analizi:teknoloji bağımlılığı üzerine bir uygulama,İstanbul Üniversitesi,Türkçe,Doktora,İstatistik = Statistics ; İşletme = Business Administration
807724,SAYGIN DİLER,2023,Veri kalitesinin bozulduğu durumlarda veri madenciliği sınıflandırma algoritmalarının performanslarınınkarşılaştırılması,Van Yüzüncü Yıl Üniversitesi,Türkçe,Doktora,İstatistik = Statistics
