Tez No,Yazar,Yıl,Tez Adı,Üniversite,Dil,Tez Türü,Konu
418815,ERHAN TAHMİNCİLER,2014,Erythromcın ilacının yan etkilerinin araştırılması üzerine veri madenciliği çalışması,Okan Üniversitesi,Türkçe,Yüksek Lisans,Bilgisayar Mühendisliği Bilimleri-Bilgisayar ve Kontrol = Computer Engineering and Computer Science and Control
379558,FURKAN YENER,2014,Veri madenciliği ve optimizasyon teknikleri kullanılarak bir depo tasarımı: perakende sektöründe uygulaması,Sakarya Üniversitesi,Türkçe,Yüksek Lisans,Endüstri ve Endüstri Mühendisliği = Industrial and Industrial Engineering
391923,AHMET ZİYA NUHOĞLU,2014,Isparta kent merkezi hava kalitesi ve meteorolojik faktörler arasındaki ilişkinin veri madenciliği süreci ile tespit edilmesi,Süleyman Demirel Üniversitesi,Türkçe,Yüksek Lisans,Çevre Mühendisliği = Environmental Engineering
327044,ALİ YAWAR JAFARİ,2013,Potansiyel abonelerin kazanılmasına yönelik pazarlama stratejilerinin Veri Madenciliği ile geliştirilmesi: Konya şehri doğalgaz örneği,Selçuk Üniversitesi,Türkçe,Yüksek Lisans,Endüstri ve Endüstri Mühendisliği = Industrial and Industrial Engineering
332402,İDRİS BUDAK,2013,Veri madenciliği teknikleri ile bilgisayar ağlarında anomali tespiti,Karabük Üniversitesi,Türkçe,Yüksek Lisans,Bilgisayar Mühendisliği Bilimleri-Bilgisayar ve Kontrol = Computer Engineering and Computer Science and Control ; Matematik = Mathematics ; İstatistik = Statistics
365622,NURİ KAHRAMAN,2013,E-ticarette kullanici davranişlarinin veri madenciliği yöntemleriyle incelenmesi,Bahçeşehir Üniversitesi,Türkçe,Yüksek Lisans,Bilgisayar Mühendisliği Bilimleri-Bilgisayar ve Kontrol = Computer Engineering and Computer Science and Control ; Bilim ve Teknoloji = Science and Technology ; İstatistik = Statistics
346074,HAYRETTİN İNAN ALTUNKAYA,2013,Ülkelerin uzun dönem kredi notlarının derecelendirilmesinde önemli değişkenlerin veri madenciliği teknikleri kullanılarak belirlenmesi,Hacettepe Üniversitesi,Türkçe,Yüksek Lisans,İstatistik = Statistics
327430,BÜLENT ORDU,2013,Veri madenciliğinde sınıflayıcı teknikler ile demir çelik sektöründe uzun ürünlerin üretimine ilişkin bir tahmin modellemesi,Karabük Üniversitesi,Türkçe,Yüksek Lisans,İşletme = Business Administration
346673,GAFFARİ ÇELİK,2013,Meslek yüksekokulu öğrencilerinin başarı durumlarını etkileyen faktörlerin veri madenciliği kümeleme teknikleri kullanılarak analizi: Ağrı Meslek Yüksekokulu örneği,Atatürk Üniversitesi,Türkçe,Yüksek Lisans,Bilgisayar Mühendisliği Bilimleri-Bilgisayar ve Kontrol = Computer Engineering and Computer Science and Control
342568,BURCU ÖZCAN,2013,Akış tipi çizelgeleme problemlerinin çözümü için veri madenciliği tabanlı bir model önerisi,Kocaeli Üniversitesi,Türkçe,Doktora,Endüstri ve Endüstri Mühendisliği = Industrial and Industrial Engineering
357200,VEDAT TÜMEN,2013,Veri madenciliği yöntemleri ile güç kalitesi verilerinin incelenmesi,Tunceli Üniversitesi,Türkçe,Yüksek Lisans,Elektrik ve Elektronik Mühendisliği = Electrical and Electronics Engineering
333873,DÖNÜŞ ŞENGÜR,2013,Öğrencilerin akademik başarılarının veri madenciliği metotları ile tahmini,Fırat Üniversitesi,Türkçe,Yüksek Lisans,Eğitim ve Öğretim = Education and Training
333866,CENGİZ HARK,2013,Öğrencilerin akıllı tahtaya ilişkin tutumlarının  incelenmesine yönelik bir veri madenciliği uygulaması,Fırat Üniversitesi,Türkçe,Yüksek Lisans,Eğitim ve Öğretim = Education and Training
329416,BÜNYAMİN HATİPOĞLU,2013,Dershane eğitiminin üniversiteye yerleşmedeki etkisinin veri madenciliği ile irdelenmesi,İstanbul Aydın Üniversitesi,Türkçe,Yüksek Lisans,Bilgisayar Mühendisliği Bilimleri-Bilgisayar ve Kontrol = Computer Engineering and Computer Science and Control
330756,TUBA PALA,2013,Tıbbi karar destek sisteminin veri madenciliği yöntemleriyle gerçekleştirilmesi,Marmara Üniversitesi,Türkçe,Yüksek Lisans,Bilgisayar Mühendisliği Bilimleri-Bilgisayar ve Kontrol = Computer Engineering and Computer Science and Control
330504,MELTEM AYPERİ BÖLÜKBAŞ,2013,Çalışan memnuniyetinin veri madenciliği ile incelenmesi,Mimar Sinan Güzel Sanatlar Üniversitesi,Türkçe,Yüksek Lisans,İstatistik = Statistics
324678,HALİL İBRAHİM ÇİÇEKDAĞI,2013,Deprem verilerinin analizi için veri madenciliği yaklaşımı,Dumlupınar Üniversitesi,Türkçe,Yüksek Lisans,Deprem Mühendisliği = Earthquake Engineering ; Endüstri ve Endüstri Mühendisliği = Industrial and Industrial Engineering
337106,AHMET DEVELİ,2013,Zaman dizisi verilerinde ani değişimlerin tahmini için veri madenciliği yöntemleri ile öznitelik seçimi,İstanbul Üniversitesi,Türkçe,Yüksek Lisans,Bilgisayar Mühendisliği Bilimleri-Bilgisayar ve Kontrol = Computer Engineering and Computer Science and Control
338961,BAHAR EROL,2013,Müşteri ilişkileri yönetimi için veri madenciliği kullanılması ve sigortacılık sektörü üzerine bir uygulama,Marmara Üniversitesi,Türkçe,Yüksek Lisans,Bilgisayar Mühendisliği Bilimleri-Bilgisayar ve Kontrol = Computer Engineering and Computer Science and Control
355694,AKKENZHE SARMANOVA,2013,Veri madenciliğindeki sınıf dengesizliği sorununun giderilmesi,Yıldız Teknik Üniversitesi,Türkçe,Yüksek Lisans,Bilgisayar Mühendisliği Bilimleri-Bilgisayar ve Kontrol = Computer Engineering and Computer Science and Control
416067,MELİH KESKİN,2013,Spor ve yaşam merkezleri üzerine veri madenciliği çalışması,Okan Üniversitesi,Türkçe,Yüksek Lisans,Bilgisayar Mühendisliği Bilimleri-Bilgisayar ve Kontrol = Computer Engineering and Computer Science and Control
335657,HAKAN AHMET KILIÇARSLAN,2013,Türkiye GSM sektöründe veri madenciliği yöntemi ile sahtekarlık tespiti ve bir uygulama,Beykent Üniversitesi,Türkçe,Yüksek Lisans,Bilgisayar Mühendisliği Bilimleri-Bilgisayar ve Kontrol = Computer Engineering and Computer Science and Control ; İstatistik = Statistics
329613,AHMET SAYGILI,2013,Veri madenciliği ile mühendislik fakültesi öğrencilerinin okul başarılarının analizi,Yıldız Teknik Üniversitesi,Türkçe,Yüksek Lisans,Bilgisayar Mühendisliği Bilimleri-Bilgisayar ve Kontrol = Computer Engineering and Computer Science and Control ; Eğitim ve Öğretim = Education and Training
342511,ZEYNEP ELABİAD,2013,Web tabanlı anket sistemi ile elde edilen verilerin veri madenciliği yöntemi ile analizi,İstanbul Aydın Üniversitesi,Türkçe,Yüksek Lisans,Bilgisayar Mühendisliği Bilimleri-Bilgisayar ve Kontrol = Computer Engineering and Computer Science and Control
337540,CEREN UZAR,2013,Finansal bilgi sisteminde veri madenciliği teknolojisinin kullanılması: Borsa İstanbul üzerine bir uygulama,Dokuz Eylül Üniversitesi,Türkçe,Doktora,İşletme = Business Administration
346485,ENGİN OĞUZAY,2013,Veri madenciliği ile geliştirilen bir akıllı buzdolabı ve market sepet analizi sistemi,Trakya Üniversitesi,Türkçe,Doktora,Bilgisayar Mühendisliği Bilimleri-Bilgisayar ve Kontrol = Computer Engineering and Computer Science and Control
323166,ASLI ÇALIŞ,2013,Veri madenciliği yaklaşımı ile bireysel müşterilerin kredi ödeme performanslarının değerlendirilmesi,Kocaeli Üniversitesi,Türkçe,Yüksek Lisans,Endüstri ve Endüstri Mühendisliği = Industrial and Industrial Engineering
343799,PINAR CİHAN,2013,Veri madenciliği ile yazılım mühendisliği dersi projelerinin iyileştirilmesi,Yıldız Teknik Üniversitesi,Türkçe,Yüksek Lisans,Bilgisayar Mühendisliği Bilimleri-Bilgisayar ve Kontrol = Computer Engineering and Computer Science and Control
351610,ŞAFİYE BİLGİN,2013,Banka müşterilerinin internet bankacılığına ilişkin yaklaşımlarının veri madenciliği teknikleri ile incelenmesi,İstanbul Üniversitesi,Türkçe,Yüksek Lisans,Bankacılık = Banking
342510,MURAT AKSEL AKÇAY,2013,Dünya değerler anket verilerinin veri madenciliği yöntemiyle incelenmesi,İstanbul Aydın Üniversitesi,Türkçe,Yüksek Lisans,Bilgisayar Mühendisliği Bilimleri-Bilgisayar ve Kontrol = Computer Engineering and Computer Science and Control
355570,MUHAMMED BİLGEHAN AYTAÇ,2013,Doğrudan pazarlama aracı olarak tele pazarlama için veri madenciliği çözümleri: Banka müşterileri üzerine bir uygulama,Gazi Üniversitesi,Türkçe,Yüksek Lisans,İşletme = Business Administration
343285,MENDUH ÇERKEZİ,2013,Veri madenciliği yöntemlerini kullanarak diyabetik retinopati hastalığının teşhisi,Sakarya Üniversitesi,Türkçe,Yüksek Lisans,Bilgisayar Mühendisliği Bilimleri-Bilgisayar ve Kontrol = Computer Engineering and Computer Science and Control
351031,BURHAN GEMİCİ,2012,Veri madenciliği ve bir uygulaması,Dokuz Eylül Üniversitesi,Türkçe,Yüksek Lisans,Ekonometri = Econometrics ; İşletme = Business Administration
316600,HANİFE GÖKER,2012,Üniversite giriş sınavında öğrencilerin başarılarının veri madenciliği yöntemleri ile tahmin edilmesi,Gazi Üniversitesi,Türkçe,Yüksek Lisans,Bilgisayar Mühendisliği Bilimleri-Bilgisayar ve Kontrol = Computer Engineering and Computer Science and Control
307433,ALİ YELEGİN,2012,Mesleki eğitimde öğrenci altyapısının öğrenci eğitim başarısına etkisinin veri madenciliği yöntemleriyle ortaya çıkarılması,Beykent Üniversitesi,Türkçe,Yüksek Lisans,Bilgi ve Belge Yönetimi = Information and Records Management ; Bilgisayar Mühendisliği Bilimleri-Bilgisayar ve Kontrol = Computer Engineering and Computer Science and Control ; Eğitim ve Öğretim = Education and Training
316394,FATMA ÖNAY KOÇOĞLU,2012,Veri madenciliği sürecinde veri ayrıklaştırma yöntemlerinin karşılaştırılması ve bir uygulama,İstanbul Üniversitesi,Türkçe,Yüksek Lisans,Bilgisayar Mühendisliği Bilimleri-Bilgisayar ve Kontrol = Computer Engineering and Computer Science and Control ; Bilim ve Teknoloji = Science and Technology
321451,FERHAT ÇAKIR,2012,Veri madenciliği yöntemleri kullanılarak küçük ve orta ölçekli işletmelere ilişkin bazı verilerin çözümlenmesi,Hacettepe Üniversitesi,Türkçe,Yüksek Lisans,İstatistik = Statistics ; İşletme = Business Administration
324762,MUHAMMED FATİH ALAEDDİNOĞLU,2012,Birliktelik kuralları ile Van Gölü için mekânsal-zamansal veri madenciliği,Atatürk Üniversitesi,Türkçe,Yüksek Lisans,Bilgisayar Mühendisliği Bilimleri-Bilgisayar ve Kontrol = Computer Engineering and Computer Science and Control ; Coğrafya = Geography
309203,HARUN ÇİÇEK,2012,"Bilişim teknolojileri cihazlarının EMC, LVD ve akustik testlerinin veri madenciliği ile yorumlanması",Karabük Üniversitesi,Türkçe,Yüksek Lisans,Bilgisayar Mühendisliği Bilimleri-Bilgisayar ve Kontrol = Computer Engineering and Computer Science and Control
312162,LEİLA ROUKA,2012,Metinsel veri madenciliğinde bilgisayarlı çeviriciler,Karadeniz Teknik Üniversitesi,Türkçe,Yüksek Lisans,Bilgisayar Mühendisliği Bilimleri-Bilgisayar ve Kontrol = Computer Engineering and Computer Science and Control
315730,MUHAMMED FATİH ADAK,2012,Bir asansör simülatörü tasarımı ve trafik türünün veri madenciliğiyle belirlenmesi,Kocaeli Üniversitesi,Türkçe,Yüksek Lisans,Bilgisayar Mühendisliği Bilimleri-Bilgisayar ve Kontrol = Computer Engineering and Computer Science and Control ; Bilim ve Teknoloji = Science and Technology ; Elektrik ve Elektronik Mühendisliği = Electrical and Electronics Engineering
315202,MUSTAFA KORAY AYTEKİN,2012,Vekil sunucu verisi üzerinde veri madenciliği ile kullanıcı sorguları kümelemesi,Maltepe Üniversitesi,Türkçe,Yüksek Lisans,Bilgisayar Mühendisliği Bilimleri-Bilgisayar ve Kontrol = Computer Engineering and Computer Science and Control
301598,ABDULLAH ALPHAN ARSLAN,2012,Türkçe metinlerden anlamsal bilgi çıkarımı için bir veri madenciliği uygulaması,Başkent Üniversitesi,Türkçe,Yüksek Lisans,Bilgisayar Mühendisliği Bilimleri-Bilgisayar ve Kontrol = Computer Engineering and Computer Science and Control
326782,EBRU YILMAZ,2012,İstatiksel analiz yöntemi olarak veri madenciliğinde CHAID algoritmasi ve Türkiye\'de işgücü piyasasinin durumunun ve bunun nedenlerinin belirlenmesine ilişkin bir uygulama,Yıldız Teknik Üniversitesi,Türkçe,Yüksek Lisans,İstatistik = Statistics ; İşletme = Business Administration
327850,LEVENT BORAN,2012,Veri madenciliğinin Türk işletmelerin finansal tablolarına uygulanması ve uygulama örneği,Marmara Üniversitesi,Türkçe,Doktora,İşletme = Business Administration
318330,OĞUZ POYRAZ,2012,Tıp \'da veri madenciliği uygulamaları: Meme kanseri veri seti analizi,Trakya Üniversitesi,Türkçe,Yüksek Lisans,Bilgisayar Mühendisliği Bilimleri-Bilgisayar ve Kontrol = Computer Engineering and Computer Science and Control ; Biyoistatistik = Biostatistics
442397,MURAT AKIN,2012,Kanserli hücrelerin mikroarray gen ifadelerinin incelenmesi ve veri madenciliği yöntemleri kullanarak sınıflandırılması,Gazi Üniversitesi,Türkçe,Yüksek Lisans,Bilgisayar Mühendisliği Bilimleri-Bilgisayar ve Kontrol = Computer Engineering and Computer Science and Control
330849,HÜSEYİN TURGUT,2012,Veri madenciliği süreci kullanılarak alzheimer hastalığı teşhisine yönelik bir uygulama,Süleyman Demirel Üniversitesi,Türkçe,Yüksek Lisans,Bilgisayar Mühendisliği Bilimleri-Bilgisayar ve Kontrol = Computer Engineering and Computer Science and Control ; Bilim ve Teknoloji = Science and Technology ; Nöroloji = Neurology
303756,CEMİL KUZEY,2012,Veri madenciliğinde destek vektör makinaları ve karar ağaçları yöntemlerini kullanarak bilgi çalışanlarının kurum performansı üzerine etkisinin ölçülmesi ve bir uygulama,İstanbul Üniversitesi,Türkçe,Doktora,İşletme = Business Administration
309681,SEDAT ATEŞ,2012,Mikroekranlı hatların veri madenciliği yöntemleri ile modellenmesi,Süleyman Demirel Üniversitesi,Türkçe,Yüksek Lisans,Elektrik ve Elektronik Mühendisliği = Electrical and Electronics Engineering
344027,YUNUS KÖKVER,2012,Veri madenciliğinin nefroloji alanına uygulanması,Kırıkkale Üniversitesi,Türkçe,Yüksek Lisans,Bilgisayar Mühendisliği Bilimleri-Bilgisayar ve Kontrol = Computer Engineering and Computer Science and Control
334825,HATİCE ÇATALOLUK,2012,Gerçek tıbbi veriler üzerinde veri madenciliği yöntemlerini kullanarak hastalık teşhisi,Bilecik Şeyh Edebali Üniversitesi,Türkçe,Yüksek Lisans,Bilgisayar Mühendisliği Bilimleri-Bilgisayar ve Kontrol = Computer Engineering and Computer Science and Control ; Bilim ve Teknoloji = Science and Technology ; Mühendislik Bilimleri = Engineering Sciences
326939,EMRE YAKUT,2012,Veri madenciliği tekniklerinden C5.0 algoritması ve destek vektör makineleri ile yapay sinir ağlarının sınıflandırma başarılarının karşılaştırılması: İmalat sektöründe bir uygulama,Atatürk Üniversitesi,Türkçe,Doktora,İstatistik = Statistics ; İşletme = Business Administration
322552,FERHAT BOZKURT,2012,Mekânsal-zamansal veri madenciliği yörüngelerin durma ve hareket algoritmaları,Atatürk Üniversitesi,Türkçe,Yüksek Lisans,Bilgisayar Mühendisliği Bilimleri-Bilgisayar ve Kontrol = Computer Engineering and Computer Science and Control
321573,MEHMET ULVİ ŞİMŞEK,2012,Sosyal ağlarda veri madenciliği üzerine bir uygulama,Gazi Üniversitesi,Türkçe,Yüksek Lisans,Bilgisayar Mühendisliği Bilimleri-Bilgisayar ve Kontrol = Computer Engineering and Computer Science and Control
325108,ABDULLAH AKGÜN,2012,Seyahat acentalarında veri madenciliği: Antalya bölgesinde bir uygulama,Akdeniz Üniversitesi,Türkçe,Yüksek Lisans,Turizm = Tourism
300436,İDRİS GÖKSU,2012,Web tabanlı öğrenme ortamında veri madenciliğine dayalı öğrenci değerlendirmesi,Fırat Üniversitesi,Türkçe,Yüksek Lisans,Bilim ve Teknoloji = Science and Technology ; Eğitim ve Öğretim = Education and Training
326726,MEHMET TAŞDEMİR,2012,Veri madenciliği: Öğrenci başarısına etki eden faktörlerin regresyon analizi ile tespiti,Dicle Üniversitesi,Türkçe,Yüksek Lisans,Eğitim ve Öğretim = Education and Training ; İşletme = Business Administration
341172,HÜLYA TAVACI,2011,GSM şebekelerinde sahtekarlık yönetimi için veri madenciliği yöntemlerinin uygulanması,Bahçeşehir Üniversitesi,Türkçe,Yüksek Lisans,Bilgisayar Mühendisliği Bilimleri-Bilgisayar ve Kontrol = Computer Engineering and Computer Science and Control
294707,HÜSEYİN SÜRÜCÜ,2011,Mukayeseli Hukukta örgütlü suçlarla mücadele için istihbarat odaklı kolluk anlayışı çerçevesinde veri madenciliğinin önemi,Harp Akademileri Komutanlığı,Türkçe,Yüksek Lisans,Kamu Yönetimi = Public Administration ; Uluslararası İlişkiler = International Relations
283421,FATMA SİBEL BIRTIL,2011,Kız meslek lisesi öğrencilerinin akademik başarısızlık nedenlerinin veri madenciliği tekniği ile analizi,Afyon Kocatepe Üniversitesi,Türkçe,Yüksek Lisans,Bilgisayar Mühendisliği Bilimleri-Bilgisayar ve Kontrol = Computer Engineering and Computer Science and Control ; Eğitim ve Öğretim = Education and Training
280401,YUNUS KILIÇ,2011,Finansal başarısızlık tahmininde veri madenciliğinin kullanılması: İMKB\'de bir uygulama,Gaziantep Üniversitesi,Türkçe,Yüksek Lisans,İşletme = Business Administration
304775,FAHRETTİN CEVAHİR,2011,Bir perakende firmasına ait veriler üzerinden veri madenciliği uygulaması,Mimar Sinan Güzel Sanatlar Üniversitesi,Türkçe,Yüksek Lisans,İstatistik = Statistics
285479,SERKAN SAVAŞ,2011,GSM şebekelerinin performanslarının veri madenciliği ile analizi,Gazi Üniversitesi,Türkçe,Yüksek Lisans,Bilgisayar Mühendisliği Bilimleri-Bilgisayar ve Kontrol = Computer Engineering and Computer Science and Control ; İletişim Bilimleri = Communication Sciences
300032,FATMA TURNA,2011,Veri madenciliği teknikleriyle tramvay arıza kayıtlarından kural çıkarımı,Erciyes Üniversitesi,Türkçe,Yüksek Lisans,Endüstri ve Endüstri Mühendisliği = Industrial and Industrial Engineering ; Ulaşım = Transportation
302517,UFUK EKİM,2011,Veri madenciliği algoritmalarını kullanarak öğrenci verilerinden birliktelik kurallarının çıkarılması,Selçuk Üniversitesi,Türkçe,Yüksek Lisans,Bilgisayar Mühendisliği Bilimleri-Bilgisayar ve Kontrol = Computer Engineering and Computer Science and Control
280805,EROL TUTAL,2011,Veri madenciliği teknikleri ile döviz kuru tahmini,Gebze Yüksek Teknoloji Enstitüsü,Türkçe,Yüksek Lisans,İşletme = Business Administration
305336,TUNCAY ÖZCAN,2011,Perakende endüstrisinde raf alanı yönetimine veri madenciliği esaslı analitik bir yaklaşım,İstanbul Üniversitesi,Türkçe,Doktora,Endüstri ve Endüstri Mühendisliği = Industrial and Industrial Engineering
309250,ZEHRA KARAPINAR ŞENTÜRK,2011,Veri madenciliği ile kanser tanısı,Düzce Üniversitesi,Türkçe,Yüksek Lisans,Bilgisayar Mühendisliği Bilimleri-Bilgisayar ve Kontrol = Computer Engineering and Computer Science and Control ; Mühendislik Bilimleri = Engineering Sciences ; İstatistik = Statistics
304788,GÜLSER DONDURMACI,2011,Veri madenciliği nde regresyon ağaçları ile sınıflandırma ve bir uygulama,Mimar Sinan Güzel Sanatlar Üniversitesi,Türkçe,Doktora,İstatistik = Statistics
295890,AFAN HASAN,2011,Havayolu şirketlerinde müşteri ilişkileri yönetimini (CRM) desteklemek ve müşteri sadakatini değerlendirmek için veri madenciliğinin kullanılması,Yıldız Teknik Üniversitesi,Türkçe,Yüksek Lisans,Bilgisayar Mühendisliği Bilimleri-Bilgisayar ve Kontrol = Computer Engineering and Computer Science and Control
295839,ÖZGÜR SARIHAN,2011,Dinamik veritabanlarında veri madenciliği ve anlamsal sorgu eniyilemesi,Yıldız Teknik Üniversitesi,Türkçe,Yüksek Lisans,Bilgisayar Mühendisliği Bilimleri-Bilgisayar ve Kontrol = Computer Engineering and Computer Science and Control ; Bilim ve Teknoloji = Science and Technology
307439,HARUN BAYER,2011,Veri madenciliğinde bir metin madenciliği uygulaması,Beykent Üniversitesi,Türkçe,Yüksek Lisans,Bilgisayar Mühendisliği Bilimleri-Bilgisayar ve Kontrol = Computer Engineering and Computer Science and Control
270045,ÖZAL YILDIRIM,2010,Veri madenciliği yöntemleriyle depremlerin analizi,Fırat Üniversitesi,Türkçe,Yüksek Lisans,Bilgisayar Mühendisliği Bilimleri-Bilgisayar ve Kontrol = Computer Engineering and Computer Science and Control ; Mühendislik Bilimleri = Engineering Sciences
271548,DERYA ŞAHİN,2010,Rotalama probleminin veri madenciliği ile çözümü,Gebze Yüksek Teknoloji Enstitüsü,Türkçe,Yüksek Lisans,Bilgisayar Mühendisliği Bilimleri-Bilgisayar ve Kontrol = Computer Engineering and Computer Science and Control ; Bilim ve Teknoloji = Science and Technology
275428,CENGİZ COŞKUN,2010,Veri madenciliği algoritmaları karşılaştırılması,Dicle Üniversitesi,Türkçe,Yüksek Lisans,Matematik = Mathematics
274764,BURCU ÇARKLI,2010,Sağlık sektöründe apriori algoritması ile bir veri madenciliği uygulaması,Sakarya Üniversitesi,Türkçe,Yüksek Lisans,Bilgisayar Mühendisliği Bilimleri-Bilgisayar ve Kontrol = Computer Engineering and Computer Science and Control
269710,YUNUS YESARİ ALTINTAŞ,2010,Veri madenciliğinin tıpta kullanımı ve bir uygulama: Hemodiyaliz hastaları için risk seviyelerine göre risk faktörlerinin etkileşimlerinin incelenmesi,Gazi Üniversitesi,Türkçe,Yüksek Lisans,Endüstri ve Endüstri Mühendisliği = Industrial and Industrial Engineering
293982,SONGÜL ŞEKEROĞLU,2010,Hizmet sektöründe bir veri madenciliği uygulaması,İstanbul Teknik Üniversitesi,Türkçe,Yüksek Lisans,Endüstri ve Endüstri Mühendisliği = Industrial and Industrial Engineering ; Mühendislik Bilimleri = Engineering Sciences
275964,KAZIM YILDIZ,2010,Veri madenciliğinde yüksek boyutlu veriler ile uygulama,Marmara Üniversitesi,Türkçe,Yüksek Lisans,Bilgisayar Mühendisliği Bilimleri-Bilgisayar ve Kontrol = Computer Engineering and Computer Science and Control
253796,GÖKHAN BİLEKDEMİR,2010,Veri madenciliği tekniklerini kullanarak üretim süresi tahmini ve bir uygulama,Dokuz Eylül Üniversitesi,Türkçe,Yüksek Lisans,İşletme = Business Administration
271581,BURCU YILMAZ ŞENSOY,2010,Çizge tabanlı örneklerde kullanıcı destekli veri madenciliği,Gebze Yüksek Teknoloji Enstitüsü,Türkçe,Doktora,Bilgisayar Mühendisliği Bilimleri-Bilgisayar ve Kontrol = Computer Engineering and Computer Science and Control
265125,SAMİYE EKİM,2010,Banka etkinliği ve finansal performans ilişkisi : Türk bankacılık sektöründe veri madenciliği uygulaması,Gaziantep Üniversitesi,Türkçe,Yüksek Lisans,İşletme = Business Administration
285484,SERDAR KÜRŞAT SARIKOZ,2010,Veri madenciliği yöntemleri ile spam filtreleme,Gazi Üniversitesi,Türkçe,Yüksek Lisans,Bilgisayar Mühendisliği Bilimleri-Bilgisayar ve Kontrol = Computer Engineering and Computer Science and Control
247693,MUHAMMET AKMAN,2010,Veri madenciliğine genel bakış ve Random Forests yönteminin incelenmesi: Sağlık alanında bir uygulama,Ankara Üniversitesi,Türkçe,Yüksek Lisans,Bilgisayar Mühendisliği Bilimleri-Bilgisayar ve Kontrol = Computer Engineering and Computer Science and Control ; Biyoistatistik = Biostatistics
270157,FATMA MELTEM KOCABAŞ,2010,Veri madenciliği süreci ve gerçek bir veri seti üzerinde uygulanması,Hacettepe Üniversitesi,Türkçe,Yüksek Lisans,İstatistik = Statistics
266135,SÜLEYMAN ZAFER SEVER,2010,Yoğunluk tabanlı kümeleme metodları kullanılarak paralel veri madenciliği gerçekleştirilmesi,Maltepe Üniversitesi,Türkçe,Yüksek Lisans,Bilgisayar Mühendisliği Bilimleri-Bilgisayar ve Kontrol = Computer Engineering and Computer Science and Control
303411,MEHMET KIVRAK,2010,Veri madenciliği yöntemleri ve bir uygulama,Yüzüncü Yıl Üniversitesi,Türkçe,Yüksek Lisans,Biyoistatistik = Biostatistics
287468,ELMAS YILDIZ,2010,Veri madenciliği teknikleriyle saldırı tespiti ve bir uygulama,Gazi Üniversitesi,Türkçe,Yüksek Lisans,Bilgisayar Mühendisliği Bilimleri-Bilgisayar ve Kontrol = Computer Engineering and Computer Science and Control ; Bilim ve Teknoloji = Science and Technology ; Teknik Eğitim = Technical Education
280533,ÖMER UÇAN,2010,Dijital kütüphanelerde veri madenciliği uygulamaları: Akdeniz Üniversitesi Merkez Kütüphanesi örneği,Akdeniz Üniversitesi,Türkçe,Yüksek Lisans,Bilgi ve Belge Yönetimi = Information and Records Management ; İşletme = Business Administration
275300,GÜRLER GÜLÇE,2010,Veri ambarı ve veri madenciliği teknikleri kullanılarak öğrenci karar destek sistemi oluşturma,Pamukkale Üniversitesi,Türkçe,Yüksek Lisans,Bilgisayar Mühendisliği Bilimleri-Bilgisayar ve Kontrol = Computer Engineering and Computer Science and Control
292392,YILDIZ KOÇTÜRK,2010,Veri madenciliğinde bağlılık,İstanbul Teknik Üniversitesi,Türkçe,Yüksek Lisans,Bilgisayar Mühendisliği Bilimleri-Bilgisayar ve Kontrol = Computer Engineering and Computer Science and Control
274947,ORÇUN KÜÇÜKOĞLU,2010,Veri madenciliği yöntemlerinin hayvancılıkta kullanımı,Çanakkale Onsekiz Mart Üniversitesi,Türkçe,Yüksek Lisans,Biyoistatistik = Biostatistics
364114,ERKAN KARACA,2010,Uçak kaza ve olaylarının veri madenciliği yöntemiyle analiz edilmesi,Hava Harp Okulu Komutanlığı,Türkçe,Yüksek Lisans,Bilim ve Teknoloji = Science and Technology ; Kazalar = Accidents ; İstatistik = Statistics
303522,FATİH ÇİL,2010,Banka yatırım fonu müşteri hareketlerinin belirlenmesine yönelik bir veri madenciliği uygulaması,Gazi Üniversitesi,Türkçe,Yüksek Lisans,Endüstri ve Endüstri Mühendisliği = Industrial and Industrial Engineering
